{
  "schemaVersion": "1",
  "tool": {
    "name": "mcpload",
    "version": "0.1.0-dev"
  },
  "run": {
    "id": "example_synthetic_ts-leaky",
    "startedAt": "2026-09-29T14:00:00Z",
    "endedAt": "2026-09-29T14:40:00Z",
    "durationS": 2400,
    "scenario": "soak",
    "protocol": "2025-06-18",
    "target": {
      "url": "http://localhost:3002/mcp",
      "label": "ts-leaky (synthetic example)"
    },
    "git": {
      "sha": "9f3c2e1a7b4d5c6e8f901a2b3c4d5e6f7a8b9c0d",
      "ref": "refs/heads/main"
    },
    "k6Version": "v2.3.0",
    "load": {
      "executor": "constant-arrival-rate",
      "vus": 20,
      "maxVus": 100,
      "arrivalRate": 2,
      "arrivalTimeUnitS": 1
    },
    "generator": {
      "cores": 8,
      "cpuAvgPct": 22.4,
      "cpuMaxPct": 38.9
    }
  },
  "phases": {
    "warmupEndS": 240,
    "loadEndS": 2160,
    "cooldownEndS": 2400
  },
  "summary": {
    "reqs": 44599,
    "errors": 354,
    "errorRate": 0.007937,
    "byErrorType": {
      "auth": 0,
      "header_mismatch": 0,
      "http": 6,
      "jsonrpc": 0,
      "session_not_found": 0,
      "timeout": 23,
      "tool_iserror": 325
    },
    "iterations": 4054,
    "droppedIterations": 20,
    "toolErrors": 325
  },
  "tools": [
    {
      "name": "search",
      "reqs": 16586,
      "errors": 14,
      "errorRate": 0.00084,
      "p50": 150,
      "p95": 520,
      "p99": 2310,
      "max": 3890
    },
    {
      "name": "fast",
      "reqs": 9952,
      "errors": 0,
      "errorRate": 0,
      "p50": 14,
      "p95": 41,
      "p99": 88,
      "max": 240
    },
    {
      "name": "slow",
      "reqs": 3317,
      "errors": 9,
      "errorRate": 0.00271,
      "p50": 309,
      "p95": 352,
      "p99": 440,
      "max": 980
    },
    {
      "name": "big",
      "reqs": 3317,
      "errors": 0,
      "errorRate": 0,
      "p50": 260,
      "p95": 690,
      "p99": 1210,
      "max": 2480
    },
    {
      "name": "flaky",
      "reqs": 3317,
      "errors": 325,
      "errorRate": 0.09798,
      "p50": 46,
      "p95": 150,
      "p99": 330,
      "max": 910
    }
  ],
  "thresholds": [
    {
      "metric": "mcp_req_duration{tool:search}",
      "expr": "p(95)<800",
      "passed": true,
      "observed": 520
    },
    {
      "metric": "mcp_req_duration{tool:search}",
      "expr": "p(99)<2000",
      "passed": false,
      "observed": 2310
    },
    {
      "metric": "mcp_tool_error_rate{tool:search}",
      "expr": "rate<0.01",
      "passed": true,
      "observed": 0.00084
    },
    {
      "metric": "mcp_req_duration{tool:fast}",
      "expr": "p(95)<800",
      "passed": true,
      "observed": 41
    },
    {
      "metric": "mcp_req_duration{tool:fast}",
      "expr": "p(99)<2000",
      "passed": true,
      "observed": 88
    },
    {
      "metric": "mcp_tool_error_rate{tool:fast}",
      "expr": "rate<0.01",
      "passed": true,
      "observed": 0
    },
    {
      "metric": "mcp_req_duration{tool:slow}",
      "expr": "p(95)<800",
      "passed": true,
      "observed": 352
    },
    {
      "metric": "mcp_req_duration{tool:slow}",
      "expr": "p(99)<2000",
      "passed": true,
      "observed": 440
    },
    {
      "metric": "mcp_tool_error_rate{tool:slow}",
      "expr": "rate<0.01",
      "passed": true,
      "observed": 0.00271
    },
    {
      "metric": "mcp_req_duration{tool:big}",
      "expr": "p(95)<800",
      "passed": true,
      "observed": 690
    },
    {
      "metric": "mcp_req_duration{tool:big}",
      "expr": "p(99)<2000",
      "passed": true,
      "observed": 1210
    },
    {
      "metric": "mcp_tool_error_rate{tool:big}",
      "expr": "rate<0.01",
      "passed": true,
      "observed": 0
    },
    {
      "metric": "mcp_req_duration{tool:flaky}",
      "expr": "p(95)<800",
      "passed": true,
      "observed": 150
    },
    {
      "metric": "mcp_req_duration{tool:flaky}",
      "expr": "p(99)<2000",
      "passed": true,
      "observed": 330
    },
    {
      "metric": "mcp_tool_error_rate{tool:flaky}",
      "expr": "rate<0.2",
      "passed": true,
      "observed": 0.09798
    },
    {
      "metric": "mcp_errors{error_type:session_not_found}",
      "expr": "count<1",
      "passed": true,
      "observed": 0
    },
    {
      "metric": "mcp_reqs",
      "expr": "rate>5",
      "passed": true,
      "observed": 18.58
    }
  ],
  "series": {
    "intervalS": 30,
    "t": [
      0,
      30,
      60,
      90,
      120,
      150,
      180,
      210,
      240,
      270,
      300,
      330,
      360,
      390,
      420,
      450,
      480,
      510,
      540,
      570,
      600,
      630,
      660,
      690,
      720,
      750,
      780,
      810,
      840,
      870,
      900,
      930,
      960,
      990,
      1020,
      1050,
      1080,
      1110,
      1140,
      1170,
      1200,
      1230,
      1260,
      1290,
      1320,
      1350,
      1380,
      1410,
      1440,
      1470,
      1500,
      1530,
      1560,
      1590,
      1620,
      1650,
      1680,
      1710,
      1740,
      1770,
      1800,
      1830,
      1860,
      1890,
      1920,
      1950,
      1980,
      2010,
      2040,
      2070,
      2100,
      2130,
      2160,
      2190,
      2220,
      2250,
      2280,
      2310,
      2340,
      2370,
      2400
    ],
    "client": {
      "p95Ms": [
        null,
        424.2,
        416.1,
        427.6,
        432.2,
        426.8,
        435.3,
        406.4,
        434.9,
        401.5,
        447.2,
        409.5,
        423.7,
        452.4,
        426.9,
        445,
        432.8,
        441.3,
        420,
        450.6,
        429.1,
        463.3,
        455.5,
        451.1,
        443,
        417.4,
        430.8,
        455.8,
        449,
        454.2,
        458.3,
        460.6,
        445.7,
        458.2,
        457.2,
        467.3,
        450.2,
        452.9,
        459.4,
        458.4,
        462.9,
        436.9,
        450.3,
        475.1,
        478.3,
        481.1,
        464.1,
        456.1,
        474.1,
        449.1,
        464.5,
        472.7,
        474.3,
        440.8,
        454.6,
        484,
        486.2,
        473.2,
        468.2,
        478,
        475.8,
        483.5,
        507.6,
        470.6,
        453.6,
        488.9,
        468.4,
        479.5,
        460.9,
        461.6,
        488.6,
        483,
        null,
        null,
        null,
        null,
        null,
        null,
        null,
        null,
        null
      ],
      "errorRate": [
        null,
        0.00791,
        0.00755,
        0.01044,
        0.00845,
        0.00757,
        0.00871,
        0.0072,
        0.0075,
        0.00826,
        0.01048,
        0.01057,
        0.00855,
        0.00664,
        0.00919,
        0.00686,
        0.00791,
        0.00971,
        0.00791,
        0.00785,
        0.01034,
        0.00829,
        0.01059,
        0.01008,
        0.00837,
        0.0084,
        0.00768,
        0.01272,
        0.01175,
        0.00865,
        0.00726,
        0.01195,
        0.00809,
        0.00654,
        0.00758,
        0.00979,
        0.01054,
        0.00951,
        0.01011,
        0.00728,
        0.00759,
        0.00686,
        0.00828,
        0.00858,
        0.01115,
        0.00847,
        0.00719,
        0.0055,
        0.00894,
        0.00785,
        0.00981,
        0.00812,
        0.00823,
        0.00883,
        0.00842,
        0.00849,
        0.00896,
        0.00859,
        0.01036,
        0.008,
        0.01166,
        0.00948,
        0.00732,
        0.00971,
        0.00809,
        0.01245,
        0.0091,
        0.00832,
        0.00959,
        0.00981,
        0.00888,
        0.00734,
        null,
        null,
        null,
        null,
        null,
        null,
        null,
        null,
        null
      ],
      "rps": [
        0,
        2.73,
        5.32,
        8.27,
        11.22,
        14.23,
        16.03,
        19.39,
        22.91,
        21.47,
        22.32,
        22.5,
        22.24,
        21.4,
        22.49,
        21.07,
        22.64,
        22.3,
        21.22,
        22.1,
        22.26,
        21.34,
        22.29,
        22.23,
        22.1,
        22.45,
        22.1,
        22.38,
        20.93,
        21.44,
        21.57,
        21.34,
        21.64,
        21.82,
        21.79,
        22.61,
        21.68,
        23.07,
        22.43,
        21.88,
        22.45,
        22.41,
        21.93,
        22.01,
        22.2,
        22.62,
        22.26,
        21.97,
        22.5,
        21.97,
        21.35,
        21.96,
        22.26,
        23.43,
        22.24,
        22.97,
        23.64,
        21.68,
        22.85,
        21.59,
        22.14,
        21.31,
        22.18,
        21.44,
        21.01,
        20.85,
        21.6,
        21.39,
        22.02,
        21.46,
        21.64,
        22.1,
        0,
        0,
        0,
        0,
        0,
        0,
        0,
        0,
        0
      ],
      "droppedIterations": [
        0,
        0,
        0,
        0,
        0,
        0,
        0,
        0,
        0,
        0,
        0,
        0,
        0,
        0,
        0,
        0,
        0,
        0,
        0,
        0,
        0,
        0,
        0,
        0,
        0,
        0,
        0,
        0,
        0,
        0,
        0,
        0,
        0,
        0,
        0,
        0,
        0,
        0,
        0,
        0,
        0,
        0,
        0,
        0,
        0,
        0,
        0,
        0,
        0,
        0,
        0,
        0,
        0,
        0,
        0,
        0,
        0,
        0,
        0,
        0,
        0,
        0,
        0,
        0,
        0,
        3,
        4,
        2,
        2,
        4,
        3,
        2,
        0,
        0,